{"schemaVersion":1,"queryId":"kanban-issues","view":"kanban","columns":[{"field":"title","label":"Title"},{"field":"status","label":"Status"}],"rows":[{"id":"issue-42","source":{"path":"01-Projects/issues/issue-42.md","blockId":"issue-42"},"values":{"title":{"state":"known","value":"Improve search","source":{"path":"01-Projects/issues/issue-42.md","field":"title"}},"status":{"state":"known","value":"planned","source":{"path":"01-Projects/issues/issue-42.md","field":"status"}}}}],"groups":[{"id":"planned","label":"Planned","rowIds":["issue-42"]}],"diagnostics":[]}